name,role,company,industry,location,linkedin_bio
Ava Patel,Head of Growth,FlowMetrics,SaaS,San Francisco,VP of Growth at FlowMetrics focused on scaling B2B SaaS companies through data-driven strategies
John Smith,CTO,TechCorp,Technology,New York,Chief Technology Officer with 10+ years in enterprise software development and AI integration
Sarah Johnson,Marketing Manager,StartupCo,Software,Austin,Digital marketing specialist helping SaaS companies grow their user base through automation
Michael Chen,VP Sales,DataFlow,B2B,Seattle,Vice President of Sales at DataFlow leading enterprise client acquisition for mid-market segment
Lisa Wang,Product Manager,InnovateLab,Fintech,Boston,Senior Product Manager building innovative financial technology solutions for SMB market
David Brown,CEO,GrowthHacker,Enterprise,Chicago,Founder and CEO of GrowthHacker focused on enterprise automation and workflow optimization
Jennifer Davis,Director of Operations,ScaleUp,Mid-market,Denver,Operations Director at ScaleUp managing business processes and efficiency improvements
Robert Wilson,Senior Developer,CodeCraft,IT,Portland,Senior Software Developer specializing in backend systems and API development
Amanda Taylor,CMO,BrandBuilders,Marketing,Miami,Chief Marketing Officer driving digital transformation for B2B service companies
Kevin Lee,Founder,TechStartup,Startup,Los Angeles,Serial entrepreneur building tech solutions for small and medium businesses